{
  "schema_version": 1,
  "kind": "provider-observation",
  "provider": "azure",
  "repository": "12345678-1234-1234-1234-123456789abc",
  "target_ref": "refs/heads/main",
  "revision": "aaaaaaaaaaaaaaaaaaaaaaaaaaaaaaaaaaaaaaaa",
  "base": "bbbbbbbbbbbbbbbbbbbbbbbbbbbbbbbbbbbbbbbb",
  "observed_at": "2026-09-24T12:00:00Z",
  "artifact_digest": "7feb63ac60b5963ca55f8f3caa6098a851969ffbb184b1f780469ec8bf058f7b",
  "report_digest": "cccccccccccccccccccccccccccccccccccccccccccccccccccccccccccccccc",
  "runtime_version": "0.21.1",
  "run_id": "example-7",
  "run_url": "https://example.invalid/run/7",
  "enabled": null,
  "required_check": null,
  "all_changes": null,
  "trusted_policy": null,
  "approvals": null
}
